[
    {
        "ConfigFile":"ServerSettings.ini",
        "AutoMap":true,
        "ConfigType":"template",
        "ConfigFileTemplate":"night-of-the-dead/1420710/AMP_ServerSettings.ini"
    },
    {
        "ConfigFile":"LF/Saved/Config/ServerSettings.ini",
        "AutoMap":true,
        "ConfigType":"template",
        "ConfigFileTemplate":"night-of-the-dead/1420710/AMP_ServerSettings.ini"
    }
]